{
  "importId": "imp_example",
  "sourceVersion": "1.3.1",
  "collectorVersion": "1.3.1",
  "received": 2,
  "created": 1,
  "updated": 0,
  "skipped": 1,
  "errors": [
    {
      "index": 1,
      "stage": "adapter",
      "code": "invalid_job_payload",
      "message": "company: Field required"
    }
  ],
  "searchIntentSnapshot": {
    "selectedCities": [{"name": "武汉", "code": "101200100"}]
  },
  "sourceSnapshot": {
    "candidateCount": 0
  },
  "collectedAt": "2026-07-21T00:00:00Z",
  "createdAt": "2026-08-02T12:00:00Z",
  "items": [
    {
      "inputIndex": 0,
      "outcome": "created",
      "jobId": "job_example",
      "jobSourceId": "src_example",
      "errorCode": null,
      "errorMessage": null
    },
    {
      "inputIndex": 1,
      "outcome": "error",
      "jobId": null,
      "jobSourceId": null,
      "errorCode": "invalid_job_payload",
      "errorMessage": "company: Field required"
    }
  ]
}
